,Longitude,Latitude,State,Roadway,Direction,Name,Mile Marker,Restrooms,Restrooms(Vault Toilet),Restrooms(Portapotties),Picnic Tables,Vending Machines,Pet Walking Area,Handicapped Facilities,RV Dump,Restaurant,Gas,Scenic View
1522,-82.961512,41.369386,OH,I-80/90,EB,TP COMMODORE PERRY SERVICE PLAZA, MM100,True,False,False,True,True,True,True,False,True,True,False
1523,-82.953725,41.367727,OH,I-80/90,WB,TP ERIE ISLANDS SERVICE PLAZA, MM100,True,False,False,True,True,True,True,False,True,True,False
1524,-82.229577,41.377624,OH,I-80/90,EB,TP VERMILION VALLEY SERVICE PLAZA, MM139.5,True,False,False,True,True,True,True,True,True,True,False
1525,-84.411879,41.604428999999996,OH,I-80/90,EB,TP TIFFIN RIVER SERVICE PLAZA, MM20.8,True,False,False,True,True,True,True,True,True,True,False
1526,-84.403104,41.604490999999996,OH,I-80/90,WB,TP INDIAN MEADOW SERVICE PLAZA, MM20.8,True,False,False,True,True,True,True,True,True,True,False
1527,-82.218563,41.379607,OH,I-80/90,WB,TP MIDDLE RIDGE SERVICE PLAZA, MM139.5,True,False,False,True,True,True,True,True,True,True,False
1528,-81.27999100000001,41.656002,OH,I-90,WB,LAKE REST AREA, MM198,True,False,False,True,False,False,True,False,True,True,False
1529,-81.294175,41.649401,OH,I-90,EB,LAKE REST AREA, MM198,True,False,False,True,True,True,True,False,False,False,False
1530,-80.543719,41.925489,OH,I-90,WB,ASHTABULA WELCOME CENTER, MM242,True,False,False,True,True,True,True,False,False,False,False
1531,-82.340682,41.402367,OH,OH-2,EB,LORAIN REST AREA, MM141,True,False,False,True,False,True,True,False,False,False,False
1532,-82.33136800000001,41.403386,OH,OH-2,WB,OORAIN REST AREA, MM141,True,False,False,True,False,True,True,False,False,False,False
1533,-82.422252,40.779268,OH,OH-30,EB,RICHLAND REST AREA, MM132,True,False,False,True,True,True,True,False,False,False,False
1534,-82.41922199999999,40.780501,OH,OH-30,WB,RICHLAND REST AREA, MM132,True,False,False,True,True,True,True,False,False,False,False
1535,-80.713483,41.563682,OH,RT-11,NB/SB,ASHTABULA REST AREA, MM73,True,False,False,True,False,True,True,False,False,False,False
1536,-82.488265,41.093933,OH,SR-13,NB,FITCHVILLE REST AREA,,True,False,False,True,False,True,True,False,False,False,False
1537,-83.015801,41.528319,OH,SR-2,EB/WB,OTTAWA REST AREA, MM114.5,True,False,False,True,False,True,False,False,False,False,False
1538,-83.826831,39.019467,OH,SR-32,EB,PIKE REST AREA, MM34,True,False,False,True,False,True,True,False,False,False,False
1539,-83.824772,39.019237,OH,SR-32,WB,PIKE REST AREA LEFT TURN, MM34,True,False,False,True,False,True,True,False,False,False,False
1540,-83.231802,39.041821,OH,SR-32,EB,ATHENS REST AREA FOLLOW SIGNS, MM71,True,False,False,False,False,False,True,False,False,False,False
1541,-83.23134399999999,39.042075,OH,SR-32,WB,ATHENS REST AREA FOLLOW SIGNS, MM71,True,False,False,False,False,False,True,False,False,False,False
1542,-82.143111,38.863621,OH,SR-7,NB,GALLIA REST AREA, MM22.17,True,False,False,True,True,True,True,False,False,False,False
1543,-82.142791,38.865365999999995,OH,SR-7,SB,GALLIA REST AREA LEFT TURN, MM22.17,True,False,False,True,True,True,True,False,False,False,False
1544,-82.357349,38.600208,OH,SR-7,NB,GALLIA REST AREA, MM47.4,True,False,False,True,True,True,True,False,False,False,False
1545,-82.346515,38.600102,OH,SR-7,SB,GALLIA REST AREA LEFT TURN, MM47.4,True,False,False,True,True,True,True,False,False,False,False
1546,-83.023426,38.950835,OH,US-23,SB,PICKAWAY REST AREA, MM73.4,True,False,False,True,True,True,True,False,False,False,False
1547,-83.02323100000001,38.95057,OH,US-23,NB,PICKAWAY REST AREA LEFT EXIT, MM73.4,True,False,False,True,True,True,True,False,False,False,False
1548,-82.987412,39.738265000000006,OH,US-23,SB,SCIOTO REST AREA, MM16,True,False,False,False,True,True,True,False,False,False,False
1549,-82.987123,39.737921,OH,US-23,NB,SCIOTO REST AREA LEFT EXIT, MM16,True,False,False,False,True,True,True,False,False,False,False
1550,-83.354927,40.918569,OH,US-23,NB,WYANDOT REST AREA, MM162,True,False,False,False,True,False,False,False,False,False,False
1551,-83.335589,40.883922999999996,OH,US-23,SB,WYANDOT REST AREA, MM164,True,False,False,False,True,False,False,False,False,False,False
1552,-83.07472800000001,40.530268,OH,US-23,SB,MARION REST AREA, MM130.5,True,False,False,False,True,False,False,False,False,False,False
1553,-83.074361,40.524881,OH,US-23,NB,MARION REST AREA, MM130.5,True,False,False,False,True,False,False,False,False,False,False
1554,-84.594501,41.231711,OH,US-24,EB/WB,REST AREA,,True,False,False,False,False,True,False,False,False,False,False
1555,-84.065601,40.824201,OH,US-30,EB,ALLEN REST AREA, MM42,True,False,False,True,True,True,True,False,False,False,False
1556,-84.058131,40.824681,OH,US-30,WB,ALLEN REST AREA, MM42,True,False,False,True,True,True,True,False,False,False,False
1557,-82.422327,40.779246,OH,US-30,EB,RICHLAND REST AREA, MM131.6,True,False,False,True,True,True,True,False,False,False,False
1558,-82.41844499999999,40.780746,OH,US-30,WB,RICHLAND REST AREA, MM131.6,True,False,False,True,True,True,True,False,False,False,False
1559,-84.664105,40.911273,OH,US-30,EB,VAN WERT REST AREA, MM9.6,True,False,False,True,False,True,True,False,False,False,False
1560,-84.659701,40.908744,OH,US-30,WB,VAN WERT REST AREA, MM9.6,True,False,False,True,False,True,True,False,False,False,False
1561,-83.179084,40.807691999999996,OH,US-30,EB,WYANDOT REST AREA, MM90,True,False,False,True,True,True,True,False,False,False,False
1562,-83.168881,40.80807,OH,US-30,WB,WYANDOT REST AREA, MM90,True,False,False,True,True,True,True,False,False,False,False
1563,-82.015775,39.115606,OH,US-33,WB,DARWIN REST AREA,,True,False,False,True,False,True,True,False,False,False,False
1564,-82.019591,39.128890999999996,OH,US-33,EB,DARWIN REST AREA,,True,False,False,True,False,True,True,False,False,False,False
1565,-82.50735999999999,39.56328,OH,US-33,WB,HOCKING REST AREA, MM165.28,True,False,False,True,False,True,True,False,False,False,False
1566,-82.51004,39.56457,OH,US-33,EB,HOCKING REST AREA, MM165.27,True,False,False,True,False,True,True,False,False,False,False
1567,-82.01582900000001,39.11566,OH,US-33,WB,MEIGS REST AREA, MM215.31,True,False,False,True,False,True,True,False,False,False,False
1568,-82.019533,39.128632,OH,US-33,EB,MEIGS REST AREA, MM215.31,True,False,False,True,False,True,True,False,False,False,False
1569,-83.282274,40.200333,OH,US-33,NB,UNION REST AREA, MM97.86,True,False,False,True,False,True,True,False,False,False,False
1570,-83.288251,40.203265,OH,US-33,SB,UNION REST AREA, MM97.94,True,False,False,True,False,True,True,False,False,False,False
1571,-83.785615,40.403024,OH,US-33,WB,LOGAN REST AREA, MM65.02,True,False,False,True,False,True,True,False,False,False,False
1572,-83.789589,40.40824,OH,US-33,EB,LOGAN REST AREA, MM64.97,True,False,False,True,False,True,True,False,False,False,False
1573,-84.335436,40.556991,OH,US-33,EB,AUGLAIZE REST AREA, MM29.85,True,False,False,True,False,True,True,False,False,False,False
1574,-84.32266899999999,40.558569,OH,US-33,WB,AUGLAIZE REST AREA, MM29.94,True,False,False,True,False,True,True,False,False,False,False
1575,-82.33013299999999,38.882431,OH,US-35,WB,GALLIA REST AREA, MM163,True,False,False,True,False,True,True,False,False,False,False
1576,-82.337001,38.883263,OH,US-35,EB,GALLIA REST AREA, MM163,True,False,False,True,False,True,True,False,False,False,False
1577,-82.736005,39.164328000000005,OH,US-35,WB,JACKSON REST AREA, MM131,True,False,False,True,False,True,True,False,False,False,False
1578,-82.73954599999999,39.165764,OH,US-35,EB,JACKSON REST AREA LEFT EXIT, MM131,True,False,False,True,False,True,True,False,False,False,False
1579,-81.762248,39.236384,OH,US-50,EB,ATHENS REST AREA, MM198,True,False,False,True,False,True,True,False,False,False,False
1580,-81.756874,39.236655,OH,US-50,WB,ATHENS REST AREA LEFT EXIT, MM108,True,False,False,True,False,True,True,False,False,False,False
1581,-82.18248100000001,39.247586,OH,US-50/SR-32,WB,JACKSON REST AREA, MM65,True,False,False,True,False,True,True,False,False,False,False
1582,-82.183105,39.246741,OH,US-50/SR-32,EB,JACKSON REST AREA-LEFT EXIT, MM65,True,False,False,True,False,True,True,False,False,False,False
1583,-95.79594499999999,36.163340999999996,OK,,,CHEROKEE NATION WELCOME CENTER/TOURIST INFORMATION CENTER,,True,False,False,True,False,False,True,False,False,False,False
1584,-94.779317,36.213341,OK,US-59,NB/SB,WELCOME CENTER,,True,False,False,True,False,True,True,False,False,False,False
1585,-97.191437,34.551629,OK,I-35,SB,DAVIS REST AREA, MM59,True,False,False,True,False,True,True,True,False,False,False
1586,-97.19002900000001,34.547126,OK,I-35,NB,DAVIS REST AREA, MM59,True,False,False,True,False,True,True,True,False,False,False
1587,-97.344163,36.846887,OK,I-35,NB,CLOSED BLACKWELL REST AREA, MM224,True,False,False,True,False,True,True,False,False,False,False
1588,-97.345107,36.853753999999995,OK,I-35,SB,BLACKWELL WELCOME CENTER, MM225,True,False,False,True,True,True,True,True,False,False,False
1589,-97.134664,33.767452,OK,I-35,NB,WELCOME CENTER, MM3,True,False,False,True,True,True,True,False,False,False,False
1590,-99.834337,35.227705,OK,I-40,EB,ERICK WELCOME CENTER, MM9,True,False,False,True,False,True,True,True,False,False,False
1591,-96.724027,35.383872,OK,I-40,EB,SHAWNEE REST, MM197,True,False,False,True,False,True,True,True,False,False,False
1592,-96.721322,35.384758000000005,OK,I-40,WB,CLOSED (MAY BE PERMANENT) SHAWNEE REST, MM197,True,False,False,True,False,True,True,True,False,False,False
1593,-94.71392900000001,35.428119,OK,I-40,WB,SALLISAW WELCOME CENTER, MM314,True,False,False,True,True,True,True,True,False,False,False
1594,-94.684368,35.409807,OK,I-40,EB,SALLISAW REST AREA, MM316,True,False,False,True,True,True,True,True,False,False,False
1595,-97.890661,35.080008,OK,I-44/H E BAILEY TP,EB,CHICKASHA SERVICE PLAZA LEFT EXIT, MM85,True,False,False,True,False,False,True,False,True,True,False
1596,-97.88833199999999,35.083905,OK,I-44/H E BAILEY TP,WB,CHICKASHA SERVICE PLAZA LEFT EXIT, MM85,True,False,False,True,False,False,True,False,True,True,False
1597,-97.051528,35.679829,OK,I-44/TURNER TP,WB,WELLSTON SERVICE PLAZA LEFT EXIT, MM157,True,False,False,True,False,False,True,False,True,True,False
1598,-96.88264699999999,35.719271,OK,I-44/TURNER TP,EB,CHANDLER FUEL SERVICE AREA, MM167,True,False,False,False,False,False,True,False,False,True,False
1599,-96.693639,35.750411,OK,I-44/TURNER TP,EB,STROUD SERVICE PLAZA LEFT EXIT, MM177,True,False,False,True,False,False,True,False,True,True,False
1600,-96.683645,35.752829,OK,I-44/TURNER TP,WB,STROUD SERVICE PLAZA LEFT EXIT, MM177,True,False,False,True,False,False,True,False,True,True,False
1601,-96.375922,35.853281,OK,I-44/TURNER TP,EB,BRISTOW SERVICE PLAZA, MM197,True,False,False,True,False,False,True,False,True,True,False
1602,-95.150649,36.621947,OK,I-44/WILL ROGERS TP,EB,VINITA SERVICE PLAZA, MM289,True,False,False,True,False,False,True,False,True,True,False
1603,-95.145328,36.624576,OK,I-44/WILL ROGERS TP,WB,VINITA SERVICE PLAZA, MM289,True,False,False,True,False,False,True,False,True,True,False
1604,-96.251112,35.946121000000005,OK,I-44/TURNER TP,WB,HEYBURN SERVICE PLAZA, MM207,True,False,False,True,False,False,True,False,False,True,False
1605,-95.79934,36.162306,OK,I-44,EB,CHEROKEE NATION WELCOME CENTER FOLLOW SIGNS, MM238,True,False,False,True,False,False,True,False,False,False,False
1606,-95.789969,36.162607,OK,I-44,WB,CHEROKEE NATION WELCOME CENTER FOLLOW SIGNS, MM238,True,False,False,True,False,False,True,False,False,False,False
1607,-98.410289,34.372182,OK,I-44/H E BAILEY TP,WB,WALTERS SERVICE PLAZA LEFT EXIT, MM20,True,False,False,True,True,False,True,False,True,True,False
1608,-98.408748,34.368161,OK,I-44/H E BAILEY TP,EB,WALTERS SERVICE PLAZA LEFT EXIT, MM20,True,False,False,True,True,False,True,False,True,True,False
1609,-94.84499699999999,36.876459999999994,OK,I-44/WILL ROGERS TP,WB,MIAMI SERVICE PLAZA/WELCOME CENTER, MM313,True,False,False,True,True,True,True,True,False,False,False
1610,-95.823861,34.902888,OK,INDIAN NATION TP,NB,McALESTER SERVICE PLAZA LEFT EXIT, MM66,True,False,False,False,False,True,True,False,True,True,False
1611,-95.826264,34.909715000000006,OK,INDIAN NATION TP,SB,McALESTER SERVICE PLAZA LEFT EXIT, MM66,True,False,False,False,False,True,True,False,True,True,False
1612,-95.424471,35.853359999999995,OK,SR-165,EB,TP MUSKOGEE NORTH SERVICE PLAZA LEFT EXIT, MM25,True,False,False,False,False,True,True,False,True,True,False
1613,-95.418172,35.852225,OK,SR-165,WB,TP MUSKOGEE NORTH SERVICE PLAZA LEFT EXIT, MM25,True,False,False,False,False,True,True,False,True,True,False
1614,-94.95450100000001,36.214451000000004,OK,US-412,EB,CHEROKEE TP SERVICE PLAZA LEFT EXIT, MM10,True,False,False,False,False,True,True,False,True,True,False
1615,-94.947275,36.214711,OK,US-412,WB,CHEROKEE TP SERVICE PLAZA LEFT EXIT, MM10,True,False,False,False,False,True,True,False,True,True,False
1616,-96.799391,36.224371000000005,OK,US-412,EB,CIMARRON TP LONE CHIMNEY SERVICE PLAZA LEFT EXIT, MM36,True,False,False,False,False,True,True,False,True,True,False
1617,-96.794591,36.225341,OK,US-412,WB,CIMARRON TP LONE CHIMNEY SERVICE PLAZA LEFT EXIT, MM36,True,False,False,False,False,True,True,False,True,True,False
1618,-94.784086,36.211853000000005,OK,US-412,EB,WELCOME CENTER FOLLOW SIGNS,,True,False,False,True,False,True,True,False,False,False,False
1619,-94.774765,36.21223,OK,US-412,WB,WELCOME CENTER FOLLOW SIGNS,,True,False,False,True,False,True,True,False,False,False,False
1620,-122.74185700000001,42.226997999999995,OR,,,ASHLAND WELCOME CENTER, ,True,False,False,False,False,False,True,False,False,False,False
1621,-123.132525,42.410222999999995,OR,I-5,SB,VALLEY OF THE ROGUE STATE PARK FOLLOW SIGNS, MM457,True,False,False,True,False,True,True,True,False,False,False
1622,-123.12843500000001,42.414072999999995,OR,I-5,NB,VALLEY OF THE ROGUE STATE PARK FOLLOW SIGNS, MM45.7,True,False,False,True,False,True,True,True,False,False,False
1623,-122.73824099999999,42.227191,OR,I-5,NB,ASHLAND WELCOME CENTER FOLLOW SIGNS, MM19,True,False,False,False,False,False,True,False,False,False,False
1624,-122.743055,42.228786,OR,I-5,SB,ASHLAND WELCOME CENTER FOLLOW SIGNS, MM19,True,False,False,False,False,False,True,False,False,False,False
1625,-122.789084,42.257939,OR,I-5,SB,SUNCREST REST AREA, MM22,True,False,False,True,True,True,True,False,False,False,False
1626,-123.363001,42.512879,OR,I-5,NB,MANZANITA REST AREA, MM62.8,True,False,False,True,True,True,True,False,False,False,False
1627,-123.366469,42.521699,OR,I-5,SB,MANZANITA REST AREA, MM62.8,True,False,False,True,True,True,True,False,False,False,False
1628,-123.284031,42.93444,OR,I-5,NB,JORDAN CREEK REST AREA FOLLOW SIGNS, MM99,True,False,False,True,True,True,True,False,False,False,False
1629,-123.29428999999999,42.945941,OR,I-5,SB,JORDAN CREEK REST AREA FOLLOW SIGNS, MM99,True,False,False,True,True,True,True,False,False,False,False
1630,-123.316805,43.46717,OR,I-5,NB,CABIN CREEK REST AREA, MM143,True,False,False,True,True,True,True,False,False,False,False
1631,-123.32189699999999,43.478959,OR,I-5,SB,CABIN CREEK REST AREA, MM144,True,False,False,True,True,True,True,False,False,False,False
1632,-123.02200800000001,43.847933000000005,OR,I-5,NB,GETTINGS CREEK REST AREA, MM178,True,False,False,True,True,True,True,False,False,False,False
1633,-123.019774,43.853539000000005,OR,I-5,SB,GETTINGS CREEK REST AREA, MM178,True,False,False,True,True,True,True,False,False,False,False
1634,-123.06045900000001,44.23206,OR,I-5,NB,OAK GROVE REST AREA, MM206,True,False,False,True,True,True,True,False,False,False,False
1635,-123.061012,44.240248,OR,I-5,SB,OAK GROVE REST AREA, MM206,True,False,False,True,True,True,True,False,False,False,False
1636,-123.052475,44.738372999999996,OR,I-5,NB,SANTIAM RIVER REST AREA, MM240,True,False,False,True,True,True,True,False,False,False,False
1637,-123.051956,44.747227,OR,I-5,SB,SANTIAM RIVER REST AREA, MM240,True,False,False,True,True,True,True,False,False,False,False
1638,-122.778727,45.268471000000005,OR,I-5,NB,FRENCH PRAIRIE REST AREA, MM281,True,False,False,True,True,True,True,False,False,False,False
1639,-122.771827,45.277584000000004,OR,I-5,SB,FRENCH PRAIRIE REST AREA, MM281,True,False,False,True,True,True,True,False,False,False,False
1640,-121.47553700000002,45.702715000000005,OR,I-84,WB,KOBERG BEACH STATE PARK REST AREA, MM66,True,False,False,True,False,False,False,False,False,False,False
1641,-118.237066,45.343332000000004,OR,I-84,EB,HILGARD JUNCTION STATE PARK REST AREA FOLLOW SIGNS, MM253,True,False,False,True,False,False,False,False,False,False,False
1642,-118.22441699999999,45.34565,OR,I-84,WB,HILGARD JUNCTION STATE PARK REST AREA FOLLOW SIGNS, MM253,True,False,False,True,False,False,False,False,False,False,False
1643,-121.34795700000001,45.695543,OR,I-84,EB,MEMALOOSE REST AREA, MM73,True,False,False,True,False,True,True,True,False,False,False
1644,-121.335329,45.695201000000004,OR,I-84,WB,MEMALOOSE REST AREA, MM73,True,False,False,True,False,True,True,True,False,False,False
1645,-116.979348,44.050684999999994,OR,I-84,EB,ONTARIO STATE RECREATIONAL SITE FOLLOW SIGNS, MM371,True,False,False,True,False,False,False,False,False,False,False
1646,-116.973592,44.046634999999995,OR,I-84,WB,ONTARIO STATE RECREATIONAL SITE FOLLOW SIGNS, MM371,True,False,False,True,False,False,False,False,False,False,False
1647,-118.509101,45.598994,OR,I-84,EB,DEADMAN PASS REST AREA FOLLOW SIGNS, MM228,True,False,False,True,True,True,True,True,False,False,False
1648,-118.503514,45.600171,OR,I-84,WB,DEADMAN PASS REST AREA FOLLOW SIGNS, MM228,True,False,False,True,True,True,True,True,False,False,False
1649,-118.015251,45.238147999999995,OR,I-84,EB,CHARLES REYNOLDS REST AREA, MM269.2,True,False,False,True,True,True,True,True,False,False,False
1650,-118.012216,45.232136,OR,I-84,WB,CHARLES REYNOLDS REST AREA, MM269.2,True,False,False,True,True,True,True,False,False,False,False
1651,-119.772539,45.831651,OR,I-84,EB,BOARDMAN REST AREA, MM160.,True,False,False,True,True,True,True,False,False,False,False
1652,-119.763516,45.832808,OR,I-84,WB,BOARDMAN REST AREA, MM160.9,True,False,False,True,True,True,True,False,False,False,False
1653,-119.255229,45.771511,OR,I-84,EB,STANFIELD REST AREA, MM187,True,False,False,True,True,True,True,False,False,False,False
1654,-119.246973,45.770583,OR,I-84,WB,STANFIELD REST AREA, MM187,True,False,False,True,True,True,True,False,False,False,False
1655,-117.82218600000002,44.918701,OR,I-84,EB,BAKER VALLEY REST AREA, MM295,True,False,False,True,True,True,True,False,False,False,False
1656,-117.81926499999999,44.910525,OR,I-84,WB,BAKER VALLEY REST AREA, MM295,True,False,False,True,True,True,True,False,False,False,False
1657,-117.370074,44.498591,OR,I-84,EB,WEATHERBY REST AREA-FOLLOW SIGNS, MM335,True,False,False,True,True,True,True,False,False,False,False
1658,-117.36689199999999,44.494584,OR,I-84,WB,WEATHERBY REST AREA-FOLLOW SIGNS, MM335,True,False,False,True,True,True,True,False,False,False,False
1659,-116.94365800000001,44.013054,OR,I-84,WB,ONTARIO WELCOME CENTER REST AREA, MM377,True,False,False,True,True,True,True,False,False,False,False
1660,-121.69424599999999,45.687807,OR,I-84,EB,TURNOUT CARS ONLY, MM55,True,False,False,False,False,False,False,False,False,False,False
1661,-121.32558300000001,45.706286,OR,SR-14,EB,CHAMBERLAIN LAKE REST AREA, MM73,True,False,False,True,False,True,True,False,False,False,False
1662,-121.322553,45.705982,OR,SR-14,WB,CHAMBERLAIN LAKE REST AREA LEFT EXIT, MM73,True,False,False,True,False,True,True,False,False,False,False
1663,-120.777934,42.972513,OR,SR-31,NB/SB,SUMMER LAKE REST AREA,,True,False,False,True,False,True,False,False,False,False,False
1664,-123.862875,46.249161,OR,SR-401,EB,DISMAL NITCH REST AREA, MM1,True,False,False,True,False,True,True,False,False,False,False
1665,-123.858801,46.250303,OR,SR-401,WB,DISMAL NITCH REST AREA LEFT EXIT, MM1,True,False,False,True,False,True,True,False,False,False,False
1666,-122.456597,43.738451,OR,SR-58,EB/WB,OAKRIDGE PARK WAYSIDE,,True,False,False,True,False,True,True,False,False,False,False
1667,-124.304693,42.066393,OR,US-101,SB,HARRIS BEACH REST AREA LEFT EXIT,,True,False,False,True,True,True,True,True,False,False,False
1668,-124.30396699999999,42.065602,OR,US-101,NB,HARRIS BEACH REST AREA,,True,False,False,True,True,True,True,True,False,False,False
1669,-123.80533600000001,45.397690000000004,OR,US-101,NB/SB,MUNSON CREEK REST AREA,,True,False,False,True,True,True,True,False,False,False,False
1670,-119.319801,43.532601,OR,US-20,EB/WB,SAGE HEN REST AREA, MM43,True,False,False,True,False,False,True,True,False,False,False
1671,-118.611571,43.647991,OR,US-20,EB/WB,BUCHANAN REST AREA, MM160,True,False,False,True,False,False,True,False,False,False,False
1672,-123.461876,45.796853999999996,OR,US-26,EB/WB,SUNSET REST AREA, MM29,True,False,False,True,False,False,True,False,False,False,False
1673,-120.029362,42.833795,OR,US-395,NB,REST AREA, MM126,True,False,False,True,False,False,True,False,False,False,False
1674,-120.028522,42.834895,OR,US-395,SB,REST AREA, MM126,True,False,False,True,False,False,True,False,False,False,False
1675,-121.788196,43.169518,OR,US-97,NB,BEAVER MARSH REST AREA, MM206,True,False,False,True,False,False,True,False,False,False,False
1676,-121.783825,43.180339000000004,OR,US-97,SB,BEAVER MARSH REST AREA, MM206,True,False,False,True,False,False,True,False,False,False,False
1677,-75.142038,40.99116,PA,,NB/SB,DELAWARE WATER GAP WELCOME CENTER,,True,False,False,True,True,True,True,False,False,False,False
1678,-75.629671,40.967573,PA,I-476,NB,TP HICKORY RUN SERVICE PLAZA-FOLLOW SIGNS, MM86,True,False,False,True,True,False,True,False,True,True,False
1679,-75.62890300000001,40.971404,PA,I-476,SB,TP HICKORY RUN SERVICE PLAZA-FOLLOW SIGNS, MM86,True,False,False,True,True,False,True,False,True,True,False
1680,-75.554641,40.572734000000004,PA,I-476,NB,TP ALLENTOWN SERVICE PLAZA, MM56,True,False,False,True,True,False,True,True,True,True,False
1681,-75.557045,40.576452,PA,I-476,SB,TP ALLENTOWN SERVICE PLAZA, MM56,True,False,False,True,True,False,True,True,True,True,False
1682,-80.44421700000001,40.116177,PA,I-70,EB,CLAYSVILLE WELCOME CENTER, MM5,True,False,False,True,True,True,True,False,False,False,False
1683,-78.234729,39.922658,PA,I-70,EB,EMMAVILLE REST AREA, MM153,True,False,False,True,True,True,True,False,False,False,False
1684,-78.181794,39.733934999999995,PA,I-70,WB,WARFORDSBURG WELCOME CENTER, MM171,True,False,False,True,True,True,True,False,False,False,False
1685,-79.048295,40.000847,PA,I-76,EB,TP SOUTH SOMERSET SERVICE PLAZA, MM112.3,True,False,False,True,True,True,True,False,True,True,False
1686,-79.042898,39.999190999999996,PA,I-76,WB,TP NORTH SOMERSET SERVICE PLAZA, MM112.3,True,False,False,True,True,True,True,False,True,True,False
1687,-79.817163,40.522403999999995,PA,I-76,EB,TP OAKMONT PLUM SERVICE PLAZA, MM49.3,True,False,False,True,True,True,True,False,True,True,False
1688,-79.563761,40.204251,PA,I-76,WB,TP NEW STANTON SERVICE PLAZA, MM77.6,True,False,False,True,True,True,True,False,True,True,False
1689,-77.590538,40.166539,PA,I-76,WB,TP BLUE MOUNTAIN SERVICE PLAZA, MM202.5,True,False,False,True,True,True,True,False,True,True,False
1690,-77.292075,40.205494,PA,I-76,EB,TP CUMBERLAND VALLEY SERVICE PLAZA, MM219.1,True,False,False,True,True,True,True,False,True,True,False
1691,-76.745958,40.210327,PA,I-76,EB,TP HIGHSPIRE SERVICE PLAZA, MM249.7,True,False,False,True,True,True,True,False,True,True,False
1692,-76.017088,40.204232,PA,I-76,EB,TP BOWMANSVILLE SERVICE PLAZA-LEFT EXIT, MM289.9,True,False,False,True,True,True,True,False,True,True,False
1693,-75.774188,40.120438,PA,I-76,WB,TP PETER J CAMILE SERVICE PLAZA, MM304.8,True,False,False,True,True,True,True,False,True,True,False
1694,-75.36776,40.088521,PA,I-76,WB,TP KING OF PRUSSIA SERVICE PLAZA, MM328.4,True,False,False,True,True,True,True,False,True,True,False
1695,-78.495281,40.031902,PA,I-76,EB,TP SOUTH MIDWAY SERVICE PLAZA, MM147.3,True,False,False,True,True,True,True,True,True,True,False
1696,-78.488801,40.028984,PA,I-76,WB,TP NORTH MIDWAY SERVICE PLAZA, MM147.3,True,False,False,True,True,True,True,True,True,True,False
1697,-78.086235,40.058478,PA,I-76,EB,TP SIDELING HILL SERVICE PLAZA-FOLLOW, MM172.3,True,False,False,True,True,True,True,True,True,True,False
1698,-78.083095,40.057536999999996,PA,I-76,WB,TP SIDELING HILL SERVICE PLAZA-FOLLOW, MM172.3,True,False,False,True,True,True,True,True,True,True,False
1699,-76.57134599999999,40.207786,PA,I-76,WB,TP LAWN SERVICE PLAZA, MM258.8,True,False,False,True,True,True,True,True,True,True,False
1700,-75.443087,40.082796,PA,I-76,EB,TP VALLEY FORGE SERVICE PLAZA, MM324.6,True,False,False,True,True,True,True,True,True,True,False
1701,-75.19407199999999,40.676782,PA,I-78,WB,WELCOME CENTER REST AREA USE RIGHT TOLL LANE, MM76,True,False,False,True,True,True,True,False,False,False,False
1702,-80.076923,39.793061,PA,I-79,NB,WELCOME CENTER, MM6,True,False,False,True,True,True,True,False,False,False,False
1703,-80.139706,40.329203,PA,I-79,NB,REST AREA, MM50,True,False,False,True,True,True,True,False,False,False,False
1704,-80.138684,40.331334000000005,PA,I-79,SB,REST AREA, MM50,True,False,False,True,True,True,True,False,False,False,False
1705,-80.122863,41.066948,PA,I-79,NB,REST AREA, MM107,True,False,False,True,True,True,True,False,False,False,False
1706,-80.144891,41.104205,PA,I-79,SB,REST AREA, MM110,True,False,False,True,True,True,True,False,False,False,False
1707,-80.161612,41.452936,PA,I-79,NB,REST AREA, MM135,True,False,False,True,True,True,True,False,False,False,False
1708,-80.167372,41.470325,PA,I-79,SB,REST AREA, MM135,True,False,False,True,True,True,True,False,False,False,False
1709,-80.175831,41.838161,PA,I-79,NB,REST AREA, MM163,True,False,False,True,True,True,True,False,False,False,False
1710,-80.176023,41.848413,PA,I-79,SB,WELCOME CENTER, MM163,True,False,False,True,True,True,True,False,False,False,False
