,Longitude,Latitude,State,Roadway,Direction,Name,Mile Marker,Restrooms,Restrooms(Vault Toilet),Restrooms(Portapotties),Picnic Tables,Vending Machines,Pet Walking Area,Handicapped Facilities,RV Dump,Restaurant,Gas,Scenic View
0,-147.814902,61.800549,AK,AK-1,EB/WB,MATANUSKA GLACIER STATE REC PARK REST AREA,MM101,True,False,False,True,False,True,True,False,False,False,True
1,-87.4185,30.575840000000003,AL,I-10,WB,BALDWIN COUNTY WELCOME CENTER, MM65.8,True,False,False,True,True,True,True,False,False,False,False
2,-88.39303199999999,30.477238,AL,I-10,EB,GRAND BAY WELCOME CENTER, MM0.45,True,False,False,True,True,True,True,True,False,False,False
3,-85.369424,33.667729,AL,I-20,WB,CLEBURNE WELCOME CENTER, MM213,True,False,False,True,True,True,True,False,False,False,False
4,-86.309572,33.850691999999995,AL,I-59,NB,ST CLAIR COUNTY REST AREA, MM164,True,False,False,True,True,True,True,True,False,False,False
5,-86.26854,33.874538,AL,I-59,SB,ST CLAIR COUNTY REST AREA, MM167,True,False,False,True,True,True,True,True,False,False,False
6,-85.557909,34.709337,AL,I-59,SB,DEKALB COUNTY WELCOME CENTER, MM241,True,False,False,True,True,True,True,True,False,False,False
7,-88.401527,32.449365,AL,I-59/20,NB,SUMTER COUNTY WELCOME CENTER, MM0.1,True,False,False,True,True,True,True,True,False,False,False
8,-87.959059,32.841501,AL,I-59/20,NB,GREENE COUNTY REST AREA, MM38,True,False,False,True,True,True,True,True,False,False,False
9,-87.327741,33.188344,AL,I-59/20,NB,TUSCALOOSA COUNTY REST AREA, MM85,True,False,False,True,True,True,True,True,False,False,False
10,-87.93813399999999,32.858956,AL,I-59/20,SB,GREENE COUNTY REST AREA, MM39,True,False,False,True,True,True,True,True,False,False,False
11,-87.319811,33.190905,AL,I-59/20,SB,TUSCALOOSA COUNTY REST AREA, MM85,True,False,False,True,True,True,True,True,False,False,False
12,-86.866031,34.071669,AL,I-65,NB,CULLMAN COUNTY REST AREA, MM300,True,False,False,True,True,True,True,True,False,False,False
13,-86.63306800000001,32.902094,AL,I-65,NB,CHILTON COUNTY REST AREA, MM213,True,False,False,True,True,True,True,True,False,False,False
14,-86.610235,31.881885999999998,AL,I-65,NB,BUTLER COUNTY REST AREA, MM133,True,False,False,True,True,True,True,True,False,False,False
15,-87.113734,31.336915,AL,I-65,NB,CONECUH COUNTY REST AREA, MM84,True,False,False,True,True,True,True,True,False,False,False
16,-86.890553,34.956755,AL,I-65,SB,ARDMORE WELCOME CENTER CENTER, MM364,True,False,False,True,True,True,True,True,False,False,False
17,-86.86665500000001,34.079928,AL,I-65,SB,CULLMAN COUNTY REST AREA, MM300,True,False,False,True,True,True,True,True,False,False,False
18,-86.63901899999999,32.909824,AL,I-65,SB,CHILTON COUNTY REST AREA, MM213,True,False,False,True,True,True,True,True,False,False,False
19,-86.608385,31.885525,AL,I-65,SB,BUTLER COUNTY REST AREA, MM133,True,False,False,True,True,True,True,True,False,False,False
20,-87.047289,31.374923,AL,I-65,SB,CONECUH COUNTY REST AREA, MM89,True,False,False,True,True,True,True,True,False,False,False
21,-85.617779,32.496995,AL,I-85,NB,MACON COUNTY REST AREA, MM43.6,True,False,False,True,True,True,True,True,False,False,False
22,-85.60645600000001,32.505728000000005,AL,I-85,SB,MACON COUNTY REST AREA, MM44.5,True,False,False,True,True,True,True,True,False,False,False
23,-85.193662,32.841031,AL,I-85,SB,LANETT WELCOME CENTER, MM78,True,False,False,True,True,True,True,True,False,False,False
24,-85.40756800000001,31.007808,AL,US-231,NB,HOUSTON COUNTY WELCOME CENTER, MM0.7,True,False,False,True,False,True,True,False,False,False,False
25,-85.408172,31.007849,AL,US-231,SB,HOUSTON COUNTY WELCOME CENTER-LEFT EXIT, MM0.7,True,False,False,True,False,True,True,False,False,False,False
26,-85.583124,31.390784000000004,AL,US-231,SB,DALE COUNTY REST AREA, MM37.8,True,False,False,True,False,True,True,False,False,False,False
27,-85.581593,31.390019,AL,US-231,NB,DALE COUNTY REST AREA-LEFT EXIT, MM37.7,True,False,False,True,False,True,True,False,False,False,False
28,-86.29611899999999,31.090612,AL,US-331,NB,COVINGTON COUNTY REST AREA, MM8,True,False,False,True,True,True,True,False,False,False,False
29,-86.29521700000001,31.093259999999997,AL,US-331,SB,COVINGTON COUNTY REST AREA-LEFT EXIT, MM8.1,True,False,False,True,True,True,True,False,False,False,False
30,-85.175733,31.781335,AL,US-431,NB,BARBOUR COUNTY REST AREA-LEFT EXIT, MM58.7,True,False,False,True,False,True,True,True,False,False,False
31,-85.175622,31.781558,AL,US-431,SB,BARBOUR COUNTY REST AREA, MM58.8,True,False,False,True,False,True,True,True,False,False,False
32,-86.885931,32.776324,AL,US-82,WB,CHILTON COUNTY REST AREA, MM105.3,True,False,False,True,True,True,True,True,False,False,False
33,-86.88924899999999,32.778364,AL,US-82,EB,CHILTON COUNTY REST AREA-LEFT EXIT, MM105.3,True,False,False,True,True,True,True,True,False,False,False
34,-93.938549,33.516077,AR,I-30,EB,TEXARKANA WELCOME CENTER, MM7.2,True,False,False,True,True,True,True,False,False,False,False
35,-93.263439,33.92752,AR,I-30,EB,GURDON REST AREA, MM48,True,False,False,True,True,True,True,False,False,False,False
36,-92.893597,34.349389,AR,I-30,EB,SOCIAL SPRINGS REST AREA, MM92,True,False,False,True,True,True,True,False,False,False,False
37,-93.24643499999999,33.941061,AR,I-30,WB,GURDON REST AREA, MM57,True,False,False,True,True,True,True,False,False,False,False
38,-92.89023900000001,34.353064,AR,I-30,WB,SOCIAL SPRINGS REST AREA, MM92,True,False,False,True,True,True,True,False,False,False,False
39,-93.346476,35.371105,AR,I-40,EB,BIG PINEY REST AREA, MM67.9,True,False,False,True,False,True,True,False,False,False,False
40,-93.346787,35.371495,AR,I-40,WB,WELCOME CENTER, MM274,True,False,False,True,False,True,True,False,False,False,False
41,-93.281021,35.33582,AR,I-40,WB,BIG PINEY REST AREA, MM72.3,True,False,False,True,False,True,True,False,False,False,False
42,-91.474944,34.835305,AR,I-40,EB,WHITE RIVER REST AREA, MM199,True,False,False,True,True,True,True,False,False,False,False
43,-94.401021,35.459878,AR,I-40,EB,VAN BUREN/FT SMITH WELCOME CENTER, MM2.6,True,False,False,True,True,True,True,False,False,False,False
44,-90.870575,34.997308000000004,AR,I-40,EB,FORREST CITY REST AREA, MM235,True,False,False,True,True,True,True,False,False,False,False
45,-93.85098599999999,35.521014,AR,I-40,EB,OZARK REST AREA, MM36,True,False,False,True,True,True,True,False,False,False,False
46,-91.469778,34.836917,AR,I-40,WB,WHITE RIVER REST AREA, MM199,True,False,False,True,True,True,True,False,False,False,False
47,-90.75617199999999,35.037237,AR,I-40,WB,FORREST CITY REST AREA, MM243,True,False,False,True,True,True,True,False,False,False,False
48,-93.832348,35.517471,AR,I-40,WB,OZARK REST AREA, MM36,True,False,False,True,True,True,True,False,False,False,False
49,-89.87477700000001,35.943902,AR,I-55,SB,BLYTHEVILLE WELCOME CENTER, MM4,True,False,False,True,False,True,True,False,False,False,False
50,-91.385672,33.546036,AR,US-165,SB,(NT) HARRISON REST AREA,,True,False,False,True,False,True,True,False,False,False,False
51,-91.386367,33.544731,AR,US-165,NB,(NT) HARRISON REST AREA,,True,False,False,True,False,True,True,False,False,False,False
52,-92.635067,33.18492,AR,US-167,SB,EL DORADO WELCOME CENTER LEFT EXIT-SE CORNER 82/167,,True,False,False,True,False,True,True,False,False,False,False
53,-92.635113,33.183328,AR,US-167,NB,EL DORADO WELCOME CENTER NB-SE CORNER 82/167,,True,False,False,True,False,True,True,False,False,False,False
54,-91.606144,35.614813,AR,US-167,SB,REST AREA, MM8,True,False,False,True,False,True,True,False,False,False,False
55,-91.606551,35.613069,AR,US-167,NB,REST AREA LEFT EXIT, MM8,True,False,False,True,False,True,True,False,False,False,False
56,-94.562489,36.176207,AR,US-412,EB,SILOAM SPRINGS WELCOME CENTER,,True,False,False,True,False,True,True,False,False,False,False
57,-94.564423,36.176407,AR,US-412,WB,SILOAM SPRINGS WELCOME CENTER,,True,False,False,True,False,True,True,False,False,False,False
58,-90.604826,34.503079,AR,US-49,WB,HELENA WELCOME CENTER, MM28,True,False,False,True,False,True,True,False,False,False,False
59,-90.605665,34.502639,AR,US-49,EB,HELENA WELCOME CENTER, MM28,True,False,False,True,False,True,True,False,False,False,False
60,-91.536011,36.49592,AR,US-63,NB/SB,MAMMOTH SPRING WELCOME CENTER,,True,False,False,True,False,True,True,False,False,False,False
61,-91.151814,36.123427,AR,US-63/412,SB/EB,BLACK ROCK REST AREA,,True,False,False,True,True,True,True,False,False,False,False
62,-91.150625,36.122531,AR,US-63/412,NB/WB,BLACK ROCK REST AREA LEFT EXIT,,True,False,False,True,True,True,True,False,False,False,False
63,-91.38257800000001,33.546892,AR,US-65,SB,(NT) HARRISON WELCOME CENTER, MM16.9,True,False,False,True,False,True,True,False,False,False,False
64,-91.381652,33.545442,AR,US-65,NB,(NT) HARRISON WELCOME CENTER LEFT EXIT, MM16.9,True,False,False,True,False,True,True,False,False,False,False
65,-91.278204,33.300053999999996,AR,US-65,NB,LAKE VILLAGE WELCOME CENTER,,True,False,False,True,False,True,True,False,False,False,False
66,-91.279762,33.301079,AR,US-65,SB,LAKE VILLAGE WELCOME CENTER,,True,False,False,True,False,True,True,False,False,False,False
67,-90.546719,36.483517,AR,US-67,SB,CORNING WELCOME CENTER, MM7.2,True,False,False,True,False,True,True,False,False,False,False
68,-90.547822,36.482633,AR,US-67,NB,CORNING WELCOME CENTER LEFT EXIT, MM7.2,True,False,False,True,False,True,True,False,False,False,False
69,-92.898275,34.536296,AR,US-70,EB,GLENWOOD REST AREA,,True,False,False,True,False,True,True,False,False,False,False
70,-92.89665,34.537019,AR,US-70,WB,GLENWOOD REST AREA LEFT EXIT,,True,False,False,True,False,True,True,False,False,False,False
71,-94.120502,35.025631,AR,US-71,NB,WALDRON REST AREA,,True,False,False,True,False,True,True,False,False,False,False
72,-94.12154100000001,35.028242,AR,US-71,SB,WALDRON REST AREA LEFT EXIT,,True,False,False,True,False,True,True,False,False,False,False
73,-94.233073,36.43197,AR,US-71,SB,BENTONVILLE WELCOME CENTER,,True,False,False,True,False,True,True,False,False,False,False
74,-94.232359,36.431956,AR,US-71,NB,BENTONVILLE WELCOME CENTER LEFT EXIT,,True,False,False,True,False,True,True,False,False,False,False
75,-94.042874,33.542972999999996,AR,US-71,NB,RED RIVER WELCOME CENTER LEFT EXIT, MM8.3,True,False,False,True,False,True,True,False,False,False,False
76,-94.043787,33.547993,AR,US-71,SB,RED RIVER WELCOME CENTER LEFT EXIT, MM8.3,True,False,False,True,False,True,True,False,False,False,False
77,-92.198412,34.058554,AR,US-79,NB,RISON REST AREA,,True,False,False,True,False,True,True,False,False,False,False
78,-92.198454,34.061002,AR,US-79,SB,RISON REST AREA LEFT EXIT,,True,False,False,True,False,True,True,False,False,False,False
79,-92.632524,33.187587,AR,US-82,WB,EL DORADO WELCOME CENTER FOLLOW SIGNS,,True,False,False,True,False,True,True,False,False,False,False
80,-92.637937,33.185567,AR,US-82,EB,EL DORADO WELCOME CENTER FOLLOW SIGNS,,True,False,False,True,False,True,True,False,False,False,False
81,-114.456597,33.617614,AZ,I-10,EB,EHRENBERG REST AREA, MM5,True,False,False,True,True,True,True,False,False,False,False
82,-114.44373799999998,33.621743,AZ,I-10,WB,EHRENBERG REST AREA, MM5,True,False,False,True,True,True,True,False,False,False,False
83,-113.650444,33.613287,AZ,I-10,EB,BOUSE WASH REST AREA, MM53,True,False,False,True,True,True,True,False,False,False,False
84,-113.639995,33.612353000000006,AZ,I-10,WB,BOUSE WASH REST AREA, MM53,True,False,False,True,True,True,True,False,False,False,False
85,-113.075053,33.521172,AZ,I-10,EB,BURNT WELL REST AREA, MM86,True,False,False,True,True,True,True,False,False,False,False
86,-113.06278799999998,33.519759,AZ,I-10,WB,BURNT WELL REST AREA, MM86,True,False,False,True,True,True,True,False,False,False,False
87,-111.78659499999999,33.045287,AZ,I-10,EB,SACATON REST AREA, MM182,True,False,False,True,True,True,True,False,False,False,False
88,-111.769622,33.024532,AZ,I-10,WB,SACATON REST AREA, MM182,True,False,False,True,True,True,True,False,False,False,False
89,-110.07995700000001,32.056886999999996,AZ,I-10,EB,TEXAS CANYON REST AREA, MM320,True,False,False,True,True,True,True,False,False,False,False
90,-110.07501200000002,32.062734999999996,AZ,I-10,WB,TEXAS CANYON REST AREA, MM320,True,False,False,True,True,True,True,False,False,False,False
91,-109.09359099999999,32.237604,AZ,I-10,EB,SAN SIMON REST AREA, MM388,True,False,False,True,True,True,True,False,False,False,False
92,-109.08358799999999,32.237747,AZ,I-10,WB,SAN SIMON REST AREA, MM388,True,False,False,True,True,True,True,False,False,False,False
93,-111.77747099999999,34.670907,AZ,I-17,NB,McGUIREVILLE REST AREA, MM297,True,False,False,True,True,True,True,False,False,False,False
94,-111.768134,34.674548,AZ,I-17,SB,McGUIREVILLE REST AREA, MM297,True,False,False,True,True,True,True,False,False,False,False
95,-112.133471,34.189116,AZ,I-17,SB,SUNSET POINT REST AREA, MM252,True,False,False,True,True,True,True,False,False,False,True
96,-112.13261999999999,34.188244,AZ,I-17,NB,SUNSET POINT REST AREA-FOLLOW SIGNS, MM252,True,False,False,True,True,True,True,False,False,False,True
97,-111.037531,31.762005,AZ,I-19,NB,CANOA RANCH REST AREA, MM55,True,False,False,True,True,True,True,False,False,False,False
98,-111.031585,31.774455,AZ,I-19,SB,CANOA RANCH REST AREA, MM55,True,False,False,True,True,True,True,False,False,False,False
99,-111.00830800000001,35.106066,AZ,I-40,EB,METEOR CRATER REST AREA, MM235,True,False,False,True,False,True,True,False,False,False,False
100,-114.14541799999999,34.832318,AZ,I-40,WB,HAVILAND REST AREA, MM23,True,False,False,True,True,True,True,False,False,False,False
101,-114.14442199999999,34.828139,AZ,I-40,EB,HAVILAND REST AREA, MM23,True,False,False,True,True,True,True,False,False,False,False
102,-110.989028,35.102446,AZ,I-40,WB,METEOR CRATER REST AREA, MM235,True,False,False,True,True,True,True,False,False,False,False
103,-109.04946399999999,35.360022,AZ,I-40,WB,CLOSED FOR REHAB PAINTED CLIFFS WELCOME CENTER FOLLOW SIGNS, MM358,True,False,False,True,True,True,True,False,False,False,False
104,-109.05410400000001,35.355565000000006,AZ,I-40,EB,CLOSED FOR REHAB AINTED CLIFFS WELCOME CENTER FOLLOW SIGNS, MM358,True,False,False,True,True,True,True,False,False,False,False
105,-113.268794,32.848637,AZ,I-8,EB,SENTINEL REST AREA, MM83,True,False,False,True,True,True,True,False,False,False,False
106,-113.24967099999999,32.855361,AZ,I-8,WB,SENTINEL REST AREA, MM83,True,False,False,True,True,True,True,False,False,False,False
107,-111.73393600000001,35.032012,AZ,SR-89A,NB/SB,OAK CREEK CANYON PICNIC AREA,,True,False,False,False,False,False,False,False,False,False,True
108,-109.045172,36.998976,AZ,US-160,NB/SB,REST AREA-4 CORNERS NATIONAL MONUMENT,,True,False,False,True,False,False,False,False,False,False,False
109,-111.10694699999999,33.286978000000005,AZ,US-60,NB/SB,REST AREA (NT),,True,False,False,True,False,True,True,False,False,False,False
110,-112.67486399999999,33.909271999999994,AZ,US-60,NB/SB,HASSAYAMPA REST AREA, MM116,True,False,False,True,False,True,True,False,False,False,False
111,-111.62947199999999,36.816414,AZ,US-89A,NB/SB,NAVAJO BRIDGE REST AREA, MM538,True,False,True,False,False,False,False,False,False,False,False
112,-112.254745,36.830064,AZ,US-89A,NB/SB,PICNIC AREA/SCENIC OVERLOOK,,True,True,False,True,False,True,False,False,False,False,False
113,-120.185671,39.327558,CA,ADDRESS,,TRUCKEE DOWNTOWN WELCOME CENTER,,True,False,False,False,False,False,True,False,False,False,False
114,-122.28596499999999,40.432407,CA,ADDRESS,,ANDERSON WELCOME CENTER SHASTA OUTLETS,,True,False,False,False,False,False,True,False,False,False,False
115,-117.084465,34.847079,CA,ADDRESS,,BARSTOW TANGER OUTLETS WELCOME CENTER,,True,False,False,False,False,False,True,False,False,False,False
116,-116.42663600000002,34.120296999999994,CA,ADDRESS,,YUCCA VALLEY WELCOME CENTER,,True,False,False,False,False,False,True,False,False,False,False
117,-117.998382,33.864592,CA,ADDRESS,,BUENA PARK WELCOME CENTER CARS ONLY,,True,False,False,False,False,False,True,False,False,False,False
118,-117.38406100000002,33.202915999999995,CA,ADDRESS,,OCEANSIDE WELCOME CENTER CARS ONLY FOLLOW SIGNS,,True,False,False,False,False,False,True,False,False,False,False
119,-117.08112,34.013713,CA,I-10,EB,WILDWOOD REST AREA, MM86,True,False,False,True,False,True,True,False,False,False,False
120,-117.01742,33.956475,CA,I-10,WB,CLOSED DUE TO WATER PROBLEMS NO ETO BROOKSIDE REST AREA, MM91,True,False,False,True,False,True,True,False,False,False,False
121,-116.66091200000001,33.92237,CA,I-10,WB,WHITEWATER REST AREA, MM113,True,False,False,True,False,True,True,False,False,False,False
122,-116.66700700000001,33.922266,CA,I-10,EB,WHITEWATER REST AREA, MM113,True,False,False,True,False,True,True,False,False,False,False
123,-115.969275,33.679013,CA,I-10,EB,CACTUS CITY REST AREA, MM159,True,False,False,True,False,True,True,False,False,False,False
124,-115.959131,33.677838,CA,I-10,WB,CACTUS CITY REST AREA, MM159,True,False,False,True,False,True,True,False,False,False,False
125,-114.905177,33.607482,CA,I-10,EB,WILEY'S WELL REST AREA FOLLOW SIGNS, MM222,True,False,False,True,False,True,True,False,False,False,False
126,-114.89755500000001,33.608233,CA,I-10,WB,WILEY'S WELL REST AREA FOLLOW SIGNS, MM222,True,False,False,True,False,True,True,False,False,False,False
127,-117.085633,34.850381,CA,I-15,NB,BARSTOW TANGER OUTLETS WELCOME CENTER FOLLOW SIGNS, MM178,True,False,False,False,False,False,True,False,False,False,False
128,-117.08416000000001,34.857495,CA,I-15,SB,BARSTOW TANGER OUTLETS WELCOME CENTER FOLLOW SIGNS, MM178,True,False,False,False,False,False,True,False,False,False,False
129,-116.47401599999999,35.031282,CA,I-15,NB,CLOSED FOR CONSTRUCTION CLYDE V KANE REST AREA, MM216,True,False,False,True,False,True,True,False,False,False,False
130,-116.46654699999999,35.035789,CA,I-15,SB,CLOSED FOR CONSTRUCTION CLYDE V KANE REST AREA, MM216,True,False,False,True,False,True,True,False,False,False,False
131,-115.703298,35.433569,CA,I-15,NB,VALLEY WELLS REST AREA, MM272,True,False,False,True,True,True,True,False,False,False,False
132,-115.69834399999999,35.435844,CA,I-15,SB,VALLEY WELLS REST AREA, MM272,True,False,False,True,True,True,True,False,False,False,False
133,-122.363505,37.537109,CA,I-280,NB,CRYSTAL SPRINGS REST AREA, MM29,True,False,False,True,True,True,True,False,False,False,False
134,-116.52895600000001,34.801521,CA,I-40,EB,DESERT OASIS REST AREA, MM28,True,False,False,True,False,True,True,False,False,False,False
135,-116.51751100000001,34.799975,CA,I-40,WB,DESERT OASIS REST AREA, MM28,True,False,False,True,False,True,True,False,False,False,False
136,-115.22268100000001,34.808704,CA,I-40,EB,CLOSED NO ETO JOHN WILKIE REST AREA, MM106,True,False,False,True,False,True,True,False,False,False,False
137,-115.21616599999999,34.810022,CA,I-40,WB,CLOSED NO ETO JOHN WILKIE REST AREA, MM106,True,False,False,True,False,True,True,False,False,False,False
138,-122.28246899999999,40.424593,CA,I-5,NB,ANDERSON WELCOME CENTER FOLLOW SIGNS SHASTA OUTLETS, MM667,True,False,False,False,False,False,True,False,False,False,False
139,-122.288008,40.440391999999996,CA,I-5,SB,ANDERSON WELCOME CENTER FOLLOW SIGNS SHASTA OUTLETS, MM667,True,False,False,False,False,False,True,False,False,False,False
140,-118.00201499999999,33.868155,CA,I-5,SB,BUENA PARK WELCOME CENTER CARS ONLY FOLLOW SIGNS, MM116,True,False,False,False,False,False,True,False,False,False,False
141,-117.99853700000001,33.866884000000006,CA,I-5,NB,BUENA PARK WELCOME CENTER CARS ONLY FOLLOW SIGNS, MM116,True,False,False,False,False,False,True,False,False,False,False
142,-122.31568500000002,40.792327,CA,I-5,NB,O'BRIEN REST AREA, MM694,True,False,False,True,False,True,True,False,False,False,False
143,-122.182217,39.244784,CA,I-5,SB,MAXWELL REST AREA, MM584,True,False,False,True,False,True,True,False,False,False,False
144,-122.18156499999999,39.237544,CA,I-5,NB,CLOSED NO ETO MAXWELL REST AREA, MM584,True,False,False,True,False,True,True,False,False,False,False
145,-121.615471,38.672761,CA,I-5,SB,ELKHORN REST AREA, MM537,True,False,False,True,False,False,True,False,False,False,False
146,-119.427241,35.420374,CA,I-5,SB,CLOSED FOR MAINTENANCE NO ETO BUTTONWILLOW REST AREA, MM259,True,False,False,True,True,True,True,False,False,False,False
147,-119.419671,35.415437,CA,I-5,NB,CLOSED FOR MAINTENANCE NO ETO BUTTONWILLOW REST AREA, MM259,True,False,False,True,True,True,True,False,False,False,False
148,-122.209355,39.596027,CA,I-5,SB,WILLOWS REST AREA, MM608,True,False,False,True,False,True,True,True,False,False,False
149,-122.20925,39.589438,CA,I-5,NB,WILLOWS REST AREA, MM608,True,False,False,True,False,True,True,True,False,False,False
150,-122.20004399999999,39.94307,CA,I-5,NB,LT JOHN C HELMICK REST AREA, MM632,True,False,False,True,False,True,True,False,False,False,False
151,-122.200473,39.950839,CA,I-5,SB,LT JOHN C HELMICK REST AREA, MM632,True,False,False,True,False,True,True,False,False,False,False
152,-121.32621699999999,37.584761,CA,I-5,SB,WESTLEY REST AREA, MM445,True,False,False,True,True,True,True,True,False,False,False
153,-121.320371,37.581034,CA,I-5,NB,WESTLEY REST AREA, MM445,True,False,False,True,True,True,True,True,False,False,False
154,-118.86873100000001,34.830621,CA,I-5,SB,TEJON PASS REST AREA, MM207,True,False,False,True,True,True,True,True,False,False,False
155,-118.87361399999999,34.825196999999996,CA,I-5,NB,TEJON PASS REST AREA, MM207,True,False,False,True,True,True,True,True,False,False,False
156,-117.445031,33.275376,CA,I-5,SB,ALISO CREEK REST AREA, MM60,True,False,False,True,True,True,True,True,False,False,False
157,-117.43304599999999,33.265842,CA,I-5,NB,ALISO CREEK REST AREA, MM60,True,False,False,True,True,True,True,True,False,False,False
158,-122.569776,41.859532,CA,I-5,SB,RANDOLPH E COLLIER REST AREA-FOLLOW SIGNS, MM786,True,False,False,True,False,True,True,False,False,False,False
159,-122.57063799999999,41.853578999999996,CA,I-5,NB,RANDOLPH E COLLIER REST AREA-FOLLOW SIGNS, MM786,True,False,False,True,False,True,True,False,False,False,False
160,-122.45789099999999,41.480247999999996,CA,I-5,SB,WEED AIRPORT REST AREA-FOLLOW SIGNS, MM753,True,False,False,True,False,True,True,False,False,False,False
161,-122.45191499999999,41.472215000000006,CA,I-5,NB,WEED AIRPORT REST AREA-FOLLOW SIGNS, MM753,True,False,False,True,False,True,True,False,False,False,False
162,-122.401389,40.921161,CA,I-5,SB,LAKEHEAD REST AREA, MM705,True,False,False,True,True,True,True,False,False,False,False
163,-122.270948,40.27395,CA,I-5,SB,HEBERT S MILES REST AREA, MM656,True,False,False,True,False,True,True,False,False,False,False
164,-122.259969,40.248081,CA,I-5,NB,HEBERT S MILES REST AREA, MM656,True,False,False,True,False,True,True,False,False,False,False
165,-121.980728,38.895453,CA,I-5,SB,DUNNIGAN REST AREA, MM557,True,False,False,True,False,True,True,False,False,False,False
166,-121.97688600000001,38.889221,CA,I-5,NB,DUNNIGAN REST AREA, MM557,True,False,False,True,False,True,True,False,False,False,False
167,-120.78523899999999,36.866253,CA,I-5,SB,JOHN ERRECA REST AREA, MM386,True,False,False,True,True,True,True,False,False,False,False
168,-120.78065500000001,36.860709,CA,I-5,NB,JOHN ERRECA REST AREA, MM386,True,False,False,True,True,True,True,False,False,False,False
169,-120.11814199999999,36.092799,CA,I-5,SB,COALINGA REST AREA, MM321,True,False,False,True,True,True,True,False,False,False,False
170,-120.11171200000001,36.086482000000004,CA,I-5,NB,COALINGA REST AREA, MM321,True,False,False,True,True,True,True,False,False,False,False
171,-117.384868,33.206221,CA,I-5,SB,OCEANSIDE WELCOME CENTER CARS ONLY FOLLOW SIGNS, MM54B,True,False,False,False,False,False,True,False,False,False,False
172,-117.37850900000001,33.202711,CA,I-5,NB,OCEANSIDE WELCOME CENTER CARS ONLY FOLLOW SIGNS, MM54A,True,False,False,False,False,False,True,False,False,False,False
173,-114.891605,32.737155,CA,I-8,WB,SAND HILLS REST AREA-LEFT EXIT, MM20,True,False,False,False,False,False,True,False,False,False,False
174,-114.889575,32.737232,CA,I-8,EB,SAND HILLS REST AREA-LEFT EXIT, MM20,True,False,False,False,False,False,True,False,False,False,False
175,-115.672822,32.773694,CA,I-8,EB,ETO SUNBEAM REST AREA, MM108,True,False,False,True,True,True,True,True,False,False,False
176,-115.665454,32.774142,CA,I-8,WB,ETO SUNBEAM REST AREA, MM108,True,False,False,True,False,True,True,True,False,False,False
177,-116.48699099999999,32.763057,CA,I-8,EB,BUCKMAN SPRINGS REST AREA FOLLOW SIGNS, MM51,True,False,False,True,False,True,True,True,False,False,False
178,-116.482413,32.756553000000004,CA,I-8,WB,BUCKMAN SPRINGS REST AREA FOLLOW SIGNS, MM51,True,False,False,True,False,True,True,True,False,False,False
179,-120.19543,39.324154,CA,I-80,EB,TRUCKEE WELCOME CENTER FOLLOW SIGNS, MM186,True,False,False,False,False,False,True,False,False,False,False
180,-120.191978,39.326443,CA,I-80,WB,TRUCKEE WELCOME CENTER FOLLOW SIGNS, MM186,True,False,False,False,False,False,True,False,False,False,False
181,-120.852502,39.179353000000006,CA,I-80,EB,GOLD RUN REST AREA, MM143,True,False,False,True,True,True,True,False,False,False,False
182,-120.33748,39.34297,CA,I-80,WB,DONNER SUMMIT REST AREA SCENIC VISTA, MM175,True,False,False,True,False,True,True,False,False,False,False
183,-120.343251,39.340474,CA,I-80,EB,DONNER SUMMIT REST AREA SCENIC VISTA, MM175,True,False,False,True,False,True,True,False,False,False,False
184,-120.851774,39.180501,CA,I-80,WB,GOLD RUN REST AREA, MM143,True,False,False,True,True,True,True,False,False,False,False
185,-122.214919,38.155296,CA,I-80,WB,HUNTER HILL REST AREA SCENIC VISTA, MM35,True,False,False,True,True,True,True,False,False,False,False
186,-122.943021,40.666214000000004,CA,SR-299,EB,MOON LIM LEE REST AREA,,True,False,False,True,False,True,True,False,False,False,False
187,-123.548399,40.882965000000006,CA,SR-299,WB,FRANCIS B MATHEWS REST AREA LEFT EXIT,,True,False,False,True,False,True,True,True,False,False,False
188,-123.55021799999999,40.882483,CA,SR-299,EB,FRANCIS B MATHEWS REST AREA,,True,False,False,True,False,True,True,True,False,False,False
